{
  "dispatch_entry_count": 14,
  "dispatch_routine_label": "Sprite_ShopKeeper",
  "dispatch_routine_source_range_annotation": "$0F6EEF-$0F6F11 JUMP LOCATION",
  "dispatch_table_file_offset": null,
  "dispatch_table_offset_established": false,
  "entries": [
    {
      "handler_label": "ShopItem_RedPotion150",
      "payment_call_source_line": 437,
      "price_high_expression": "$00",
      "price_high_source_line": 436,
      "price_low_expression": "$96",
      "price_low_source_line": 435,
      "price_value": 150,
      "receipt_call_source_line": 441,
      "receipt_index_expression": "$2E",
      "receipt_item_index": 46,
      "receipt_selector_source_line": 440,
      "shopkeeper_variant_id": 7,
      "source_dispatch_comment": "0x07 - $F16E",
      "source_dispatch_line": 17,
      "source_handler_address_annotation": "$F16E",
      "source_handler_label_line": 427,
      "source_handler_range_annotation": "$0F716E-$0F71AC JUMP LOCATION",
      "source_revision": "347c23f9fc019c72d32da537c9cb235f468d021d",
      "table_index": 0
    },
    {
      "handler_label": "ShopItem_FighterShield",
      "payment_call_source_line": 519,
      "price_high_expression": "$00",
      "price_high_source_line": 518,
      "price_low_expression": "$32",
      "price_low_source_line": 517,
      "price_value": 50,
      "receipt_call_source_line": 523,
      "receipt_index_expression": "$04",
      "receipt_item_index": 4,
      "receipt_selector_source_line": 522,
      "shopkeeper_variant_id": 8,
      "source_dispatch_comment": "0x08 - $F1F2",
      "source_dispatch_line": 18,
      "source_handler_address_annotation": "$F1F2",
      "source_handler_label_line": 508,
      "source_handler_range_annotation": "$0F71F2-$0F7220 JUMP LOCATION",
      "source_revision": "347c23f9fc019c72d32da537c9cb235f468d021d",
      "table_index": 1
    },
    {
      "handler_label": "ShopItem_FireShield",
      "payment_call_source_line": 562,
      "price_high_expression": "$01",
      "price_high_source_line": 561,
      "price_low_expression": "$F4",
      "price_low_source_line": 560,
      "price_value": 500,
      "receipt_call_source_line": 566,
      "receipt_index_expression": "$05",
      "receipt_item_index": 5,
      "receipt_selector_source_line": 565,
      "shopkeeper_variant_id": 9,
      "source_dispatch_comment": "0x09 - $F230",
      "source_dispatch_line": 19,
      "source_handler_address_annotation": "$F230",
      "source_handler_label_line": 551,
      "source_handler_range_annotation": "$0F7230-$0F7260 JUMP LOCATION",
      "source_revision": "347c23f9fc019c72d32da537c9cb235f468d021d",
      "table_index": 2
    },
    {
      "handler_label": "ShopItem_Heart",
      "payment_call_source_line": 608,
      "price_high_expression": "$00",
      "price_high_source_line": 607,
      "price_low_expression": "$0A",
      "price_low_source_line": 606,
      "price_value": 10,
      "receipt_call_source_line": 612,
      "receipt_index_expression": "$42",
      "receipt_item_index": 66,
      "receipt_selector_source_line": 611,
      "shopkeeper_variant_id": 10,
      "source_dispatch_comment": "0x0A - $F27D",
      "source_dispatch_line": 20,
      "source_handler_address_annotation": "$F27D",
      "source_handler_label_line": 598,
      "source_handler_range_annotation": "$0F727D-$0F72AE JUMP LOCATION",
      "source_revision": "347c23f9fc019c72d32da537c9cb235f468d021d",
      "table_index": 3
    },
    {
      "handler_label": "ShopItem_Arrows",
      "payment_call_source_line": 643,
      "price_high_expression": "$00",
      "price_high_source_line": 642,
      "price_low_expression": "$1E",
      "price_low_source_line": 641,
      "price_value": 30,
      "receipt_call_source_line": 647,
      "receipt_index_expression": "$44",
      "receipt_item_index": 68,
      "receipt_selector_source_line": 646,
      "shopkeeper_variant_id": 11,
      "source_dispatch_comment": "0x0B - $F2AF",
      "source_dispatch_line": 21,
      "source_handler_address_annotation": "$F2AF",
      "source_handler_label_line": 630,
      "source_handler_range_annotation": "$0F72AF-$0F72EF JUMP LOCATION",
      "source_revision": "347c23f9fc019c72d32da537c9cb235f468d021d",
      "table_index": 4
    },
    {
      "handler_label": "ShopItem_Bombs",
      "payment_call_source_line": 690,
      "price_high_expression": "$00",
      "price_high_source_line": 689,
      "price_low_expression": "$32",
      "price_low_source_line": 688,
      "price_value": 50,
      "receipt_call_source_line": 694,
      "receipt_index_expression": "$31",
      "receipt_item_index": 49,
      "receipt_selector_source_line": 693,
      "shopkeeper_variant_id": 12,
      "source_dispatch_comment": "0x0C - $F2F0",
      "source_dispatch_line": 22,
      "source_handler_address_annotation": "$F2F0",
      "source_handler_label_line": 673,
      "source_handler_range_annotation": "$0F72F0-$0F7321 JUMP LOCATION",
      "source_revision": "347c23f9fc019c72d32da537c9cb235f468d021d",
      "table_index": 5
    },
    {
      "handler_label": "ShopItem_Bee",
      "payment_call_source_line": 712,
      "price_high_expression": "$00",
      "price_high_source_line": 711,
      "price_low_expression": "$0A",
      "price_low_source_line": 710,
      "price_value": 10,
      "receipt_call_source_line": 716,
      "receipt_index_expression": "$0E",
      "receipt_item_index": 14,
      "receipt_selector_source_line": 715,
      "shopkeeper_variant_id": 13,
      "source_dispatch_comment": "0x0D - $F322",
      "source_dispatch_line": 23,
      "source_handler_address_annotation": "$F322",
      "source_handler_label_line": 702,
      "source_handler_range_annotation": "$0F7322-$0F7357 JUMP LOCATION",
      "source_revision": "347c23f9fc019c72d32da537c9cb235f468d021d",
      "table_index": 6
    }
  ],
  "entry_count": 7,
  "evidence": {
    "dispatch_table_offset_established": false,
    "handler_address_annotations_verified": false,
    "price_behavior_runtime_verified": false,
    "receipt_item_names_resolved": false,
    "rom_bytes_read": false,
    "room_specific_shop_stock_resolved": false,
    "source_only": true
  },
  "format": "zelda-suite-shop-item-handlers",
  "format_version": 1,
  "source_file": "sprite_shopkeeper.asm",
  "source_revision": "347c23f9fc019c72d32da537c9cb235f468d021d"
}
